{
  "deckTitle": "AI Product Roadmap Review",
  "language": "en-US",
  "audience": "Executives and product leads",
  "scenario": "Quarterly business review",
  "tone": "Professional, concise, decision-oriented",
  "theme": "business-clean",
  "sourceDisplayMode": "notes",
  "slideCount": 8,
  "needsSpeakerNotes": true,
  "assumptions": [
    "No real production metrics have been provided yet",
    "The deck is intended for executive review",
    "The current sample validates generation quality before brand-template fidelity"
  ],
  "slides": [
    {
      "page": 1,
      "layout": "title",
      "title": "AI Product Roadmap Review",
      "subtitle": "2026 H1 priorities and execution focus",
      "objective": "Align leadership on goals, timing, and resource needs",
      "bullets": [],
      "left": [],
      "right": [],
      "table": { "columns": [], "rows": [] },
      "chart": { "type": "", "title": "", "categories": [], "series": [] },
      "visuals": [],
      "sources": [],
      "speakerNotes": [
        "Open by framing the discussion around goals, sequencing, and resource requests."
      ]
    },
    {
      "page": 2,
      "layout": "agenda",
      "title": "Agenda",
      "subtitle": "",
      "objective": "Set the audience's mental model before the detail",
      "bullets": [
        "Context and goals",
        "Current challenges",
        "Roadmap design",
        "Execution plan",
        "Resources and risks",
        "Conclusion and next steps"
      ],
      "left": [],
      "right": [],
      "table": { "columns": [], "rows": [] },
      "chart": { "type": "", "title": "", "categories": [], "series": [] },
      "visuals": [],
      "sources": [],
      "speakerNotes": [
        "Keep the agenda brief and make clear that the deck ends with decision points."
      ]
    },
    {
      "page": 3,
      "layout": "bullet",
      "title": "Context and goals",
      "subtitle": "",
      "objective": "Explain why AI productization needs to accelerate now",
      "bullets": [
        "Competition is shifting from point features to end-to-end workflow efficiency",
        "Existing AI capabilities are fragmented and weakly differentiated in the product",
        "The next two quarters should convert experimental AI features into stable product capability",
        "The goal is to improve penetration, conversion, and delivery efficiency in core scenarios"
      ],
      "left": [],
      "right": [],
      "table": { "columns": [], "rows": [] },
      "chart": { "type": "", "title": "", "categories": [], "series": [] },
      "visuals": [
        "Market trend illustration",
        "Current product capability map"
      ],
      "sources": [],
      "speakerNotes": [
        "Keep the focus on business urgency rather than implementation detail."
      ]
    },
    {
      "page": 4,
      "layout": "two-column",
      "title": "Current challenges",
      "subtitle": "",
      "objective": "Separate product problems from operating-model constraints",
      "bullets": [],
      "left": [
        "Capabilities are spread across multiple modules and hard to discover",
        "AI output quality is inconsistent and lacks a shared evaluation standard",
        "Delivery still depends on repeated manual work"
      ],
      "right": [
        "The monetization path is unclear and ROI is hard to prove",
        "Cross-team execution depends too heavily on manual coordination",
        "Feedback loops are weak and iteration is slower than it should be"
      ],
      "table": { "columns": [], "rows": [] },
      "chart": { "type": "", "title": "", "categories": [], "series": [] },
      "visuals": [],
      "sources": [],
      "speakerNotes": [
        "Use the left column for product issues and the right column for execution issues."
      ]
    },
    {
      "page": 5,
      "layout": "timeline",
      "title": "Roadmap design",
      "subtitle": "",
      "objective": "Show the roadmap in phases that are easy to understand",
      "bullets": [
        "Align on core scenarios and success metrics",
        "Consolidate the capability foundation and simplify the user experience",
        "Launch priority scenarios and establish a feedback loop",
        "Package the offer for repeatable commercial deployment"
      ],
      "left": [],
      "right": [],
      "table": { "columns": [], "rows": [] },
      "chart": { "type": "", "title": "", "categories": [], "series": [] },
      "visuals": [],
      "sources": [],
      "speakerNotes": [
        "Name the phases in business terms, not only technical terms."
      ]
    },
    {
      "page": 6,
      "layout": "chart",
      "title": "KPI placeholder",
      "subtitle": "",
      "objective": "Reserve a clear place for real operating metrics",
      "bullets": [
        "These are placeholder values used to validate chart generation",
        "In production, track penetration, conversion, and usage frequency"
      ],
      "left": [],
      "right": [],
      "table": { "columns": [], "rows": [] },
      "chart": {
        "type": "bar",
        "title": "Illustrative quarterly trend",
        "categories": ["Q1", "Q2", "Q3", "Q4"],
        "series": [
          { "name": "Scenario penetration", "data": [12, 18, 26, 35] },
          { "name": "Paid conversion", "data": [4, 6, 9, 12] }
        ]
      },
      "visuals": [],
      "sources": [],
      "speakerNotes": [
        "Replace the chart field directly when real operating metrics are available."
      ]
    },
    {
      "page": 7,
      "layout": "table",
      "title": "Resources and risks",
      "subtitle": "",
      "objective": "Clarify what decisions and dependencies matter most",
      "bullets": [],
      "left": [],
      "right": [],
      "table": {
        "columns": ["Topic", "Current status", "Risk", "Mitigation"],
        "rows": [
          ["Engineering capacity", "Tight", "Slower iteration", "Focus on core scenarios and reduce parallel work"],
          ["Data feedback loop", "Incomplete", "Impact hard to measure", "Add instrumentation and user feedback capture"],
          ["Commercial validation", "Early", "Investment case remains weak", "Pilot two high-value scenarios first"]
        ]
      },
      "chart": { "type": "", "title": "", "categories": [], "series": [] },
      "visuals": [],
      "sources": [],
      "speakerNotes": [
        "This slide should make the resource request feel justified and concrete."
      ]
    },
    {
      "page": 8,
      "layout": "closing",
      "title": "Conclusion and next steps",
      "subtitle": "Once direction is confirmed, a detailed execution schedule can follow within two weeks",
      "objective": "End with concrete post-meeting actions",
      "bullets": [
        "Confirm the top two AI scenarios to prioritize",
        "Confirm the cross-functional resource model",
        "Confirm the quarterly metric set and review cadence"
      ],
      "left": [],
      "right": [],
      "table": { "columns": [], "rows": [] },
      "chart": { "type": "", "title": "", "categories": [], "series": [] },
      "visuals": [],
      "sources": [],
      "speakerNotes": [
        "Bring the discussion back to decision items rather than opening new detail."
      ]
    }
  ]
}
